gate,layer,status,evidence_output,decision,blocking_gap
G1,SSG hidden-need mining,presentation_bridge_ready_pending_refresh,outputs/tables/ssg_hidden_weakness_final_message_v3.csv;outputs/tables/ssg_layer1_objection_response_v4.csv;outputs/tables/ssg_layer1_candidate_feature_blueprint_v4.csv;outputs/tables/ssg_layer1_evidence_to_message_trace_v4.csv;outputs/tables/ssg_layer1_freeze_checklist_v4.csv,Layer 1 message is presentation/scoring-ready and can be passed into candidate feature engineering after one refreshed-data check,"needs refreshed post-2026-06-11 STATIZ/current-game data and stronger play-by-play, defense, and baserunning proxies before final freeze"
G2,KBO success/failure archetype mining,partial_plus_historical_milb_backfill,outputs/tables/kbo_foreign_archetype_summary_v0_1.csv;outputs/tables/historical_kbo_prearrival_milb_features_v1.csv,Historical MLBAM-matched KBO rows now have pre-KBO MiLB role and level context,2017-2022 historical IDs and NPB/CPBL pre-arrival context remain thin
G3,Candidate market construction,partial_plus_full_milb_and_npb_context,outputs/tables/candidate_market_coverage_v0_3.csv;outputs/tables/mlb_market_pool_milb_role_context_v1.csv;outputs/tables/milb_market_pool_stats_all_v1.csv;outputs/tables/asian_quota_market_status_v1.csv;outputs/tables/npb_player_market_features_2026_v1.csv,All MLB market rows now have attempted MiLB lookup and NPB official 2026 first-team/farm performance context is attached,"NPB contract/salary, buyout, universal nationality, medical/news, Korea-willingness, ABL, and manual feasibility checks remain"
G4,KBO translation model,pilot_plus_historical_milb_backfill,outputs/tables/kbo_translation_failure_repeated_cv_comparison_v0_1.csv;outputs/tables/historical_kbo_prearrival_milb_features_v1.csv;outputs/tables/mlb_market_pool_milb_role_context_v1.csv,Historical MiLB backfill is ready to join into translation and failure marts before retraining,repeated CV has not yet been rerun with the new historical MiLB variables
G5,Failure-risk model,pilot_plus_full_milb_role_context,outputs/tables/kbo_translation_failure_oof_predictions_v0_1.csv;outputs/tables/mlb_market_pool_milb_role_context_v1.csv;outputs/tables/historical_kbo_prearrival_milb_features_v1.csv,Full current MiLB role-continuity context is now attached to current market rows,medical/news/adaptation and contract/willingness features not yet attached
G6,Final SSG fit and shortlist,locked,docs/candidate_release_gates_v1.md;docs/run_019_milb_all_and_historical_backfill.md,candidate names remain research leads only,"unlock only after model retraining, G3 manual feasibility, NPB contract checks, refreshed Layer 1 validation, and fit-rank calibration pass"
