gate,layer,status,evidence_output,decision,blocking_gap
G1,SSG hidden-need mining,presentation_bridge_ready_pending_refresh,outputs/tables/ssg_hidden_weakness_final_message_v3.csv;outputs/tables/ssg_layer1_candidate_feature_blueprint_v4.csv,Layer 1 message is presentation/scoring-ready and passed into the fit-prep mart,Needs refreshed post-2026-06-11 STATIZ/current-game data and stronger play-by-play/defense/baserunning proxies before final freeze
G2,KBO success/failure archetype mining,fit_prep_signal_contract_attached,outputs/tables/kbo_translation_failure_feature_family_decisions_v0_3.csv;outputs/tables/ssg_fit_preparation_feature_contract_v0_1.csv,Feature-family archetypes and candidate-side signals are mapped into the locked fit-prep feature contract,2017-2022 historical IDs and NPB/CPBL pre-arrival context remain thin
G3,Candidate market construction,locked_three_slot_market_mart_built,outputs/tables/ssg_fit_preparation_mart_v0_1.csv;outputs/tables/ssg_fit_preparation_slot_summary_v0_1.csv,MLB hitter pitcher and Asian-quota rows are consolidated into one locked research mart,Salary contract buyout medical news Korea-willingness ABL and manual feasibility checks remain
G4,KBO translation model,hitter_component_in_fit_prep_mart,outputs/tables/candidate_side_hitter_savant_pilot_component_v0_1.csv;outputs/tables/candidate_side_hitter_savant_pilot_model_audit_v0_1.csv;outputs/tables/ssg_fit_preparation_mart_v0_1.csv,Hitter candidate-compatible Savant component is used as one research input in the locked fit-prep mart,Pitcher translation remains diagnostic only
G5,Failure-risk model,risk_diagnostics_visible_in_fit_prep_mart,outputs/tables/candidate_side_pitcher_milb_diagnostic_tags_v0_1.csv;outputs/tables/ssg_fit_preparation_gate_audit_v0_1.csv,Pitcher diagnostic risk and Asian-quota feasibility gaps are now visible in one mart,Medical news adaptation contract and willingness features are still missing
G6,Final SSG fit and shortlist,locked_fit_preparation_mart_built,outputs/tables/ssg_fit_preparation_mart_v0_1.csv;outputs/tables/ssg_fit_preparation_gate_audit_v0_1.csv;docs/run_023_locked_ssg_fit_preparation_mart_v0_1.md,Fit-preparation mart exists but candidate release stays locked,Unlock only after manual market checks final weighting review and all release gates pass
