gate,layer,status,evidence_output,decision,blocking_gap
G1,SSG hidden-need mining,presentation_bridge_ready_pending_refresh,outputs/tables/ssg_hidden_weakness_final_message_v3.csv;outputs/tables/ssg_layer1_candidate_feature_blueprint_v4.csv,Layer 1 message remains presentation/scoring-ready and feeds downstream fit-prep features,Needs refreshed post-2026-06-11 STATIZ/current-game data and stronger play-by-play/defense/baserunning proxies before final freeze
G2,KBO success/failure archetype mining,fit_prep_signal_contract_attached,outputs/tables/kbo_translation_failure_feature_family_decisions_v0_3.csv;outputs/tables/ssg_fit_preparation_feature_contract_v0_1.csv,Feature-family archetypes and candidate-side signals remain mapped into locked fit-prep features,2017-2022 historical IDs and NPB/CPBL pre-arrival context remain thin
G3,Candidate market construction,manual_feasibility_source_worklist_built,outputs/tables/ssg_market_realism_news_join_v0_3.csv;outputs/tables/manual_feasibility_source_worklist_v0_1.csv,Expanded English news and manual feasibility source lanes are attached to the market-realism queue,Naver/local Korean news salary opt-out transfer-fee buyout agent and willingness source values remain missing
G4,KBO translation model,hitter_component_in_fit_prep_mart,outputs/tables/candidate_side_hitter_savant_pilot_component_v0_1.csv;outputs/tables/ssg_fit_preparation_mart_v0_1.csv,Hitter candidate-compatible Savant component is used as one research input in the locked fit-prep mart,Pitcher translation remains diagnostic only
G5,Failure-risk model,manual_risk_source_lanes_built,outputs/tables/candidate_news_signal_summary_v0_3.csv;outputs/tables/manual_feasibility_source_lane_summary_v0_1.csv,Manual medical contract Korean-news and willingness source lanes are now explicit blockers,Need actual Naver/local Korean news plus manual medical adaptation and Korea-willingness values
G6,Final SSG fit and shortlist,locked_manual_feasibility_queue_built,outputs/tables/manual_feasibility_source_worklist_v0_1.csv;docs/run_027_korean_news_and_feasibility_worklist_v0_1.md,Manual feasibility queue exists but candidate release stays locked,Unlock only after full news salary contract buyout medical file agent willingness and final review gates pass
