gate,layer,status,evidence_output,decision,blocking_gap
G1,SSG hidden-need mining,presentation_bridge_ready_pending_refresh,outputs/tables/ssg_hidden_weakness_final_message_v3.csv;outputs/tables/ssg_layer1_candidate_feature_blueprint_v4.csv,Layer 1 message remains presentation/scoring-ready and feeds downstream fit-prep features,Needs refreshed post-2026-06-11 STATIZ/current-game data and stronger play-by-play/defense/baserunning proxies before final freeze
G2,KBO success/failure archetype mining,archetype_validation_and_rule_stability_built,outputs/tables/layer2_archetype_validation_matrix_v0_1.csv;outputs/tables/layer2_rule_stability_tiers_v0_1.csv;outputs/tables/layer2_historical_backfill_queue_v0_1.csv,Archetype validation tiers rule stability tiers and a 56-row backfill queue now exist,Close historical backfill queue and rerun stability validation before Layer 2 freeze
G3,Candidate market construction,fit_source_fill_packet_built,outputs/tables/ssg_fit_source_fill_packet_v0_1.csv,Layer 6 high-interest rows have source-fill statuses and next source actions,Exact salary opt-out transfer-fee buyout agent passport medical and Korea-willingness values remain manual
G4,KBO translation model,locked_pitcher_translation_proxy_built,outputs/tables/layer4_pitcher_translation_proxy_component_v0_1.csv;outputs/tables/layer4_pitcher_translation_proxy_summary_v0_1.csv,Pitcher candidate-side translation proxy exists for 1009 locked rows and separates usable manual-review and source-rebuild tiers,Attach source evidence and validate proxy against historical archetype rule tiers before final translation release
G5,Failure-risk model,source_evidence_status_attached,outputs/tables/candidate_failure_risk_ledger_v0_1.csv;outputs/tables/ssg_fit_source_fill_packet_v0_1.csv,Failure risk distinguishes missing-source blockers from source-supported manual-review rows,Need exact medical files salary opt-out buyout agent passport and Korea-willingness values before recalibration
G6,Final SSG fit and shortlist,locked_source_evidence_intake_template_built,outputs/tables/locked_source_evidence_intake_template_v0_1.csv;outputs/tables/locked_source_evidence_intake_summary_v0_1.csv;outputs/tables/locked_source_evidence_manual_field_map_v0_1.csv;outputs/tables/locked_source_evidence_intake_gate_audit_v0_1.csv,Row-level source evidence intake template exists for 473 anonymous source rows and maps each source type to manual review fields,Unlock only after reviewed URLs extracted source claims manual grades calibration and final review gates pass
