layer_no,layer_name,current_status,progress_pct,evidence_outputs,latest_run,blocking_gap,next_action,candidate_release_impact
1,SSG hidden weakness mining,presentation_bridge_ready_pending_refresh,93,outputs/tables/ssg_hidden_weakness_final_message_v3.csv;outputs/tables/ssg_layer1_plain_language_story_v4.csv;outputs/tables/ssg_layer1_objection_response_v4.csv;outputs/tables/ssg_layer1_candidate_feature_blueprint_v4.csv;outputs/tables/ssg_layer1_evidence_to_message_trace_v4.csv;outputs/tables/ssg_layer1_freeze_checklist_v4.csv;docs/run_017_ssg_layer1_presentation_bridge.md,run_017,"Layer 1 message is presentation/scoring-ready, but still needs refreshed post-2026-06-11 data and stronger play-by-play/defense/baserunning proxy validation before final freeze","Refresh STATIZ/current-game data, attach stronger play-by-play/defense/baserunning proxies, then freeze Layer 1; until then move effort to Layers 2-5",Layer 1 target features can now be passed into candidate feature engineering; final candidate release remains locked
2,KBO foreign-player success/failure archetype mining,fit_prep_signal_contract_attached,73,outputs/tables/kbo_foreign_archetype_summary_v0_1.csv;outputs/tables/kbo_translation_failure_feature_family_decisions_v0_3.csv;outputs/tables/candidate_side_hitter_savant_pilot_model_audit_v0_1.csv;outputs/tables/ssg_fit_preparation_feature_contract_v0_1.csv;docs/run_023_locked_ssg_fit_preparation_mart_v0_1.md,run_023,"Feature-family archetypes and candidate-side signals are mapped into the locked SSG fit-prep contract, but 2017-2022 historical IDs and NPB/CPBL pre-arrival context remain thin","Expand historical ID crosswalk to 2017-2022, add NPB/CPBL pre-arrival context, and calibrate final fit rules","Archetype explanations are attached to the fit-prep mart as research components; final recommendations remain locked"
3,Candidate market construction,naver_candidate_news_attached,93,outputs/tables/mlb_transactions_latest.csv;outputs/tables/mlb_roster_status_latest.csv;outputs/tables/ssg_market_realism_layer_v0_1.csv;outputs/tables/ssg_market_realism_news_join_v0_4.csv;outputs/tables/manual_feasibility_source_worklist_v0_2.csv;docs/run_029_naver_candidate_news_v0_4.md,run_029,"Naver candidate-news metadata is attached for the priority scope, but salary, opt-out, transfer-fee, buyout, agent, and Korea-willingness source values remain missing","Fill salary, opt-out, transfer-fee, buyout, agent, medical, and Korea-willingness source lanes","Current market screening now has official realism gates, expanded English news context, Naver news context, and manual source lanes; names remain research inventory only"
4,KBO translation model,hitter_component_in_fit_prep_mart,80,outputs/tables/candidate_side_hitter_savant_pilot_component_v0_1.csv;outputs/tables/candidate_side_hitter_savant_pilot_model_audit_v0_1.csv;outputs/tables/ssg_fit_preparation_mart_v0_1.csv;docs/run_023_locked_ssg_fit_preparation_mart_v0_1.md,run_023,"Candidate-compatible hitter Savant component is one input in the locked fit-prep mart, but pitcher translation remains diagnostic only","Keep hitter component as pilot input and build pitcher translation only after stronger risk/context variables","Hitter model component is in the fit-prep mart; final candidate release still not allowed"
5,Failure risk model,naver_news_risk_signals_attached,84,outputs/tables/candidate_side_pitcher_milb_diagnostic_tags_v0_1.csv;outputs/tables/ssg_market_realism_layer_v0_1.csv;outputs/tables/candidate_news_signal_summary_v0_4.csv;outputs/tables/manual_feasibility_source_lane_summary_v0_2.csv;docs/run_029_naver_candidate_news_v0_4.md,run_029,"Naver news risk tags are attached for priority candidates, but full medical/adaptation and Korea-willingness source values are still incomplete","Fill medical/adaptation/Korea-willingness source lanes","Risk hypotheses now include official market/medical blockers, expanded English news context, Naver context, and manual source-lane blockers; pitcher model remains diagnostic only"
6,SSG fit ranking,locked_naver_enriched_feasibility_queue_built,70,outputs/tables/ssg_market_realism_news_join_v0_4.csv;outputs/tables/candidate_news_signal_summary_v0_4.csv;outputs/tables/manual_feasibility_source_worklist_v0_2.csv;docs/run_029_naver_candidate_news_v0_4.md,run_029,"Final ranking remains locked because source lanes identify unresolved salary/contract/buyout, medical file review, agent/willingness checks, and final review gaps","Fill feasibility source lanes before any shortlist/recommendation labels",No shortlist/recommendation labels allowed yet
